General Category	Specific Category	Item ID	First Level Added	Store Name	Art Asset	Store Description	Art Notes	General Notes	Colour 1	Colour 2
Toys	Children's	1-1-1	1	Lulu Fashion Doll	Doll	The original Lulu fashion doll, accept no substitutes!	Doll_Red Dress_Brown Hair		Red	Brown
Toys	Children's	1-1-2	1	Lulu Fashion Doll	Doll	The original Lulu fashion doll, accept no substitutes!	(Recolour) Doll_Blue Dress_Brown Hair		Blue	Brown
Toys	Children's	1-1-3	1	Lula Fashion Doll	Doll	Now with 30% less lawsuits!	(Recolour) Doll_Yellow Dress_Brown Hair		Yellow	Brown
Toys	Children's	1-1-4	1	Lulu Fashion Doll	Doll	The original Lulu fashion doll, accept no substitutes!	(Recolour) Doll_Red Dress_Blonde Hair		Red	Yellow
Toys	Children's	1-1-5	1	Lulu Fashion Doll	Doll	The original Lulu fashion doll, accept no substitutes!	(Recolour) Doll_Blue Dress_Blonde Hair		Blue	Yellow
Toys	Children's	1-1-6	1	Lula Fashion Doll	Doll	Now with 30% less lawsuits!	(Recolour) Doll_Green Dress_Blonde Hair		Green	Yellow
Toys	Children's	1-1-7	1	Lulu Fashion Doll	Doll	The original Lulu fashion doll, accept no substitutes!	(Recolour) Doll_Yellow Dress_Red Hair		Yellow	Red
Toys	Children's	1-1-8	1	Lulu Fashion Doll	Doll	The original Lulu fashion doll, accept no substitutes!	(Recolour) Doll_Green Dress_Red Hair		Green	Red
Toys	Children's	1-1-9	1	Lula Fashion Doll	Doll	Now with 30% less lawsuits!	(Recolour) Doll_Blue Dress_Red Hair		Blue	Red
Toys	RC-Car	1-2-1	3	Motion-Trax RC Car	RCCar	The most powerful RC car on the market that is still street legal. Remote contains proprietary blue mechanical switches for the ultimate tactilile experience.	Blue RC Car		White	None
Toys	RC-Car	1-2-2	3	Motion-Trax RC Car	RCCar	The most powerful RC car on the market that is still street legal. Remote contains proprietary blue mechanical switches for the ultimate tactilile experience.	(Recolour) Red RC Car		Black	None
Toys	RC-Car	1-2-3	3	Motion-Trax RC Car	RCCar	The most powerful RC car on the market that is still street legal. Remote contains proprietary blue mechanical switches for the ultimate tactilile experience.	(Recolour) Green RC Car		Brown	None
Toys	RC-Car	1-2-4	3	Motion-Trax RC Car	RCCar	The most powerful RC car on the market that is still street legal. Remote contains proprietary blue mechanical switches for the ultimate tactilile experience.	(Recolour) Black RC Car		Black	None
Toys	Sports Equipment	1-3-1	2	MXC Bicycle	Bike	Our most extreme children's bicycle yet.	Red Children's Bike		Red	None
Toys	Sports Equipment	1-3-2	2	MXC Bicycle	Bike	Our most extreme children's bicycle yet.	(Recolour) Blue Children's Bike		Blue	None
Toys	Sports Equipment	1-3-3	2	MXC Bicycle	Bike	Our most extreme children's bicycle yet.	(Recolour) Purple Children's Bike		Purple	None
Toys	Sports Equipment	1-3-4	2	MXC Bicycle	Bike	Our most extreme children's bicycle yet.	(Recolour) Green Children's Bike		Green	None
Toys	Sports Equipment	1-3-5	2	MXC Bicycle	Bike	Our most extreme children's bicycle yet.	(Recolour) Yellow Children's Bike		Yellow	None
Toys	Sports Equipment	1-3-6	3	Rotocross Adult Kyack	Kayak	It floats, it boats, what more can you ask for?	Kyack Blue		Blue	None
Toys	Sports Equipment	1-3-7	3	Rotocross Adult Kyack	Kayak	It floats, it boats, what more can you ask for?	(Recolour) Kyack Purple		Purple	None
Toys	Sports Equipment	1-3-8	3	Rotocross Adult Kyack	Kayak	It floats, it boats, what more can you ask for?	(Recolour) Kyack Pink		Pink	None
Toys	Sports Equipment	1-3-9	3	Rotocross Adult Kyack	Kayak	It floats, it boats, what more can you ask for?	(Recolour) Kyack Yellow		Yellow	None
Toys	Hobbies	1-4-1	3	Autoblitz Model Car Kit	BoxWithCar	A scale model of the best-selling Autoblitz motorcar, prized by collectors and enthusiasts.	Box with Car on it - Black	Made generic Box Graphic	None	None
Toys	Hobbies	1-4-2	3	Autoblitz Model Car Kit	BoxWithCar	A scale model of the best-selling Autoblitz motorcar, prized by collectors and enthusiasts.	(Recolour) Box with Car on it - Red	Made generic Box Graphic	None	None
Toys	Hobbies	1-4-3	3	Autoblitz Model Car Kit	BoxWithCar	A scale model of the best-selling Autoblitz motorcar, prized by collectors and enthusiasts.	(Recolour) Box with Car on it - Blue	Made generic Box Graphic	None	None
Toys	Hobbies	1-4-4	3	Autoblitz Model Car Kit	BoxWithCar	A scale model of the best-selling Autoblitz motorcar, prized by collectors and enthusiasts.	(Recolour) Box with Car on it - Yellow	Made generic Box Graphic	None	None
Electronics	TV	2-1-1	2	Drollby HD TV	TV	50", 3 HDMI Ports, Smart TV, OLED, UHD	TV		None	None
Electronics	TV	2-1-2	2	Drollby HD TV	TV	55", 4 HDMI Ports, OLED, UHD	(Identical) TV		None	None
Electronics	TV	2-1-3	2	Drollby HD TV	TV	49", 4 HDMI Ports, OLED, UHD	(Identical) TV		None	None
Electronics	TV	2-1-4	2	Drollby HD TV	TV	80", 7 HDMI Ports, UHD	(Identical) TV		None	None
Electronics	TV	2-1-5	2	Drollby HD TV	TV	45", 3 HDMI Ports, Smart TV, OLED, UHD, Integrated Food Delivery	(Identical) TV		None	None
Food and Drinks	Wine	3-1-1	1	Francisco d'Anconia Shiraz	BottleDrink	Woody with copper notes from deep in the mines of Argentina.	Bottle of Red Wine - Label can be Squiggles		None	None
Food and Drinks	Wine	3-1-2	1	Bob Lowblaw Cabernet Sauvignon	BottleDrink	From the vineyards of retail magnate Bob Loblaw comes this verbose cabernet.	(Identical) Bottle of Red Wine - Label can be Squiggles		None	None
Food and Drinks	Wine	3-1-3	2	Scraping the Barrel Cotes du Rhone	BottleDrink	It's five o'clock somewhere!	(Identical) Bottle of Red Wine - Label can be Squiggles		None	None
Food and Drinks	Wine	3-1-4	2	Shantay You Slay, Rose Away!	BottleDrink	Slay all day with this delicious Rose. Perfect for Bachelorette parties.	(Identical) Bottle of Red Wine - Label can be Squiggles		None	None
Food and Drinks	Liquor	3-2-1	3	Dagny Taggart Premium Whisky	Whiskey	Our premium whisky, best enjoyed on long train rides through tunnels.	(Recolour) Bottle of Whisky - Label can be Squiggles		None	None
Food and Drinks	Liquor	3-2-2	3	D's Nuts Straight Kentucky Burbon	Whiskey	Notes of peat, gasoline, burnt rubber, and chemical fire.	(Recolour) Bottle of Whisky - Label can be Squiggles		None	None
Food and Drinks	Liquor	3-2-3	3	Brokeboys Mountain Canadian Whisky	Whiskey	The Official Whisky of the hit TV show Brokeboys Mountain. An unparpalelled depth of flavour with notes of oak, baroque, and Canadian bacon.	(Recolour) Bottle of Whisky - Label can be Squiggles		None	None
Food and Drinks	Liquor	3-2-4	3	Loch Osh'kosh Scotch	BottleDrink	Scotch from the oldest distillery on Loch Osh'kosh. Twenty year aged in oak barrels with notes of peat, dried herbs, warmed caramel and the briny sea depths.	(Recolour) Bottle of Whisky - Label can be Squiggles		None	None
Food and Drinks	Luxury Foods	3-3-1	3	Truffle Oil	Oil	An authentic trip to Italy in every bottle. Note: Does NOT contain any truffle.	(Recolour) Brown Bottle of Oil		Brown	None
Food and Drinks	Luxury Foods	3-3-2	3	Perilla Oil	Oil	Oil with a declicious and nutty aroma and taste.	(Recolour) Brown Bottle of Oil		Brown	None
Food and Drinks	Luxury Foods	3-3-3	3	Extra Virgin Olive Oil	Oil	Traditional Greek olive oil that will have you saying Opa!	(Recolour) Yellow Bottle of Oil		Yellow	None
Food and Drinks	Luxury Foods	3-3-4	3	Hand Crafted Undifferentiated Seed Oil	Oil	While a cheap staple in most cusines, now a rare and exotic ingredient in some places.	(Recolour) Yellow Bottle of Oil		White	None
Fashion and Jewelry	Jewelry	4-1-1	1	Silver Ring With Saphire	Ring		Saphire and Silver Ring		White	Blue
Fashion and Jewelry	Jewelry	4-1-2	1	Silver Ring With Emerald	Ring		(Recolour) Emerald and Silver Ring		White	Green
Fashion and Jewelry	Jewelry	4-1-4	1	Silver Ring With Amethyst	Ring		(Recolour) Amethyst and Silver Ring		White	Pink
Fashion and Jewelry	Jewelry	4-1-8	2	Ring with Enameled White Gardenia	RingFlower		Ring with Enameled White Gardenia		None	None
Fashion and Jewelry	Clothing	4-2-1	2	Rococo Two-tone Scarf	Scarf	A warm and cozy alpaca wool scarf, perfect for chilly evenings or cold nights.	Scarf with two-tone stripes MUST HAVE PASTELISH COLOURS (green, pink, yellow)		Green	Pink
Fashion and Jewelry	Clothing	4-2-2	2	Rococo Two-tone Scarf	Scarf	A warm and cozy alpaca wool scarf, perfect for chilly evenings or cold nights.	(Recolour) Scarf - Black and Blue		Black	Blue
Fashion and Jewelry	Clothing	4-2-3	2	Rococo Two-tone Scarf	Scarf	A warm and cozy alpaca wool scarf, perfect for chilly evenings or cold nights.	(Recolour) Scarf - Red and White		Red	White
Fashion and Jewelry	Clothing	4-2-4	2	Rococo Two-tone Scarf	Scarf	A warm and cozy alpaca wool scarf, perfect for chilly evenings or cold nights.	(Recolour) Scarf - Yellow and Brown		Yellow	Brown
Fashion and Jewelry	Shoes	4-3-1	3	Riding Dirty Cowboy Boots	Boots	Made with real panther leather, sure to wow your fellow cowpokes.	Brown Cowboy Boots		Brown	None
Fashion and Jewelry	Shoes	4-3-2	3	Riding Dirty Cowboy Boots	Boots	Made with real panther leather, sure to wow your fellow cowpokes.	(Recolour) Red Cowboy Boots		Red	None
Fashion and Jewelry	Shoes	4-3-3	3	Riding Dirty Cowboy Boots	Boots	Made with real panther leather, sure to wow your fellow cowpokes.	(Recolour) Yellow Cowboy Boots		Yellow	None
Fashion and Jewelry	Shoes	4-3-4	3	Glamified Riding Dirty Cowboy Boots	RhinestoneBoots	A glamified cersion of our classic panther leather boots. Loud and obnoxious, these boots are sure to make viewers eyes pop out of their sockets.	Sequin/Rhinestone Cowboy Boots		White	None
Home and Garden	Gardening	5-2-1	2	 Green Thumb Indoor Gardening Kit	Flowerkit	A kit for growing spring flowers indoors year round.	Box with Flowers in pink and yellow	Made generic Box Graphic	None	None
Home and Garden	Gardening	5-2-2	2	 Green Thumb Indoor Gardening Kit	Flowerkit	A kit for growing summer flowers indoors year round.	(Recolour) Box with Flowers in orange and blue	Made generic Box Graphic	Yellow	None
Home and Garden	Gardening	5-2-3	2	 Green Thumb Indoor Gardening Kit	Flowerkit	A kit for growing autumn flowers indoors year round.	(Recolour) Box with Flowers in red and purple	Made generic Box Graphic	Orange	None
Books	Fiction	6-1-1	1	Will of the West	Book	The continuation of T.D. Bank's epic tale of fantasy and PG-Romance.	Red Book - Squiggles for Cover Text		Red	None
Books	Fiction	6-1-2	1	Flack Brian	Book	International spy Flack Brian is called back into service after three decades in retirement. Which will give out first, his resolve, or his knees? Find out in this explosive thriller.	(Recolour) Brown Book		Brown	None
Books	Fiction	6-1-3	2	Baker's Dozen	Book	Veteran chef Chet Baker has to go behind enemy lines with his team of sous chefs for one final culinary mission.	(Recolour) Pink Book		Pink	None
Books	Fiction	6-1-4	2	Bronze Bootstraps	Book	A cowboy, and his bronze bootstraps face the world in this classic linguini western.	(Recolour) Green Book		Green	None
Books	Non-Fiction	6-2-1	1	Blaze of Glory	Book	The true story of Blaze of Glory, a 16th century French troubadour.	(Recolour) Orange Book		Orange	None
Books	Non-Fiction	6-2-2	1	Blastoff	Book	An oral history of the first manned trip to Mars with interviews of many of the central figures.	(Recolour) Purple Book		Purple	None
Books	Non-Fiction	6-2-3	2	Handyman Dan	Book	Handman Dan's complete guide to all things home improvement.	(Recolour) Black Book		Black	None
Books	Non-Fiction	6-2-4	2	The Life of Brian	Book	The official biography of Brian Hacksworth, 15th in line to the Dutchy of Trivvial	(Recolour) Red Book		Red	None
Books	Children's	6-3-1	1	Burt's Bees	Book	Help Burt keep his beehives in order in this choose your own adventure.	(Recolour) White Book		White	None
Books	Children's	6-3-2	1	Diana Clam	Book	Diana the clam and her friends go on an adventure to visit wally the walrus.	(Recolour) Purple Book		Purple	None
Books	Children's	6-3-3	2	Kate of Space	Book	The story of a young girl who learns to build a rocketship and travels across the galaxy.	(Recolour) Orange Book		Orange	None
Books	Children's	6-3-4	2	Felix Fixes It	Book	Can we fix it? Yes we can! Every child's favourite builder!	(Recolour) Blue Book		Blue	None